recipe_id,recipe_name,cuisine,category,dietary_type,ingredients,popularity_score,trending_score,search_count,is_trending,last_searched,common_searches,rating,prep_time_minutes,difficulty,id,course,diet,view_count,like_count,save_count,is_premium,created_at,search_tags,prep_time,difficulty_level
394.0,Easy Turkey Curry,Italian,Dessert,Regular,"onion, carrot, turkey, butter, milk, cinnamon",753.0,753.0,892.0,False,2026-03-22T12:54:41.823871,easy turkey curry | easy | easy turkey | quick easy turkey curry,4.6,15.0,Medium,,,,,,,,,,,
395.0,Spinach Pasta,Mexican,Pasta,Regular,"mushroom, onion, tomato, pork, shrimp, yogurt, cream, oregano",858.0,1232.0,927.0,True,2026-03-19T12:54:41.823901,spinach pasta | spinach | homemade spinach pasta,4.3,45.0,Medium,,,,,,,,,,,
396.0,Pork With Onion,German,Salad,Regular,"garlic, carrot, tomato, broccoli, pork, tuna, mozzarella, ginger, thyme",420.0,470.0,414.0,True,2026-03-22T12:54:41.823937,pork with onion | pork | pork with | homemade pork with onion,4.0,60.0,Hard,,,,,,,,,,,
397.0,Quick Lunch Portuguese Bowl,Asian,Dessert,Regular,"broccoli, onion, pork, beef, basil, turmeric",439.0,602.0,509.0,True,2026-03-21T12:54:41.823975,quick lunch portuguese bowl | quick | quick lunch | quick lunch portuguese | best quick lunch portuguese bowl,4.8,90.0,Easy,,,,,,,,,,,
398.0,Vietnamese Risotto Quick,Thai,Beverage,Vegetarian,"onion, broccoli, spinach, lamb, cream, cheese, basil",796.0,796.0,920.0,False,2026-02-24T12:54:41.824005,vietnamese risotto quick | vietnamese | vietnamese risotto | quick vietnamese risotto quick,3.8,15.0,Easy,,,,,,,,,,,
399.0,Caribbean Lamb,Italian,Appetizer,Regular,"broccoli, tomato, chicken, cheddar, ginger, oregano, garlic",484.0,484.0,500.0,False,2026-03-21T12:54:41.824037,caribbean lamb | caribbean | authentic caribbean lamb,5.0,30.0,Hard,,,,,,,,,,,
400.0,Quick Dinner French Bowl,Thai,Dessert,Dairy-Free,"bell pepper, garlic, salmon, cinnamon, ginger, paprika",654.0,654.0,539.0,False,2026-02-28T12:54:41.824065,quick dinner french bowl | quick | quick dinner | quick dinner french | best quick dinner french bowl,4.7,60.0,Medium,,,,,,,,,,,
401.0,Tuna With Onion,Turkish,Dinner,Regular,"cucumber, broccoli, fish, salmon, cumin, paprika, turmeric",360.0,523.0,407.0,True,2026-02-17T12:54:41.824117,tuna with onion | tuna | tuna with | easy tuna with onion,4.8,10.0,Hard,,,,,,,,,,,
402.0,Authentic Tofu Breakfast,Spanish,Appetizer,Dairy-Free,"onion, garlic, pork, beef, thyme, cinnamon",535.0,535.0,520.0,False,2026-03-01T12:54:41.824145,authentic tofu breakfast | authentic | authentic tofu | authentic authentic tofu breakfast,4.0,20.0,Easy,,,,,,,,,,,
403.0,American Tacos Easy,German,Lunch,Vegan,"bell pepper, tomato, salmon, garlic, basil, paprika",911.0,911.0,890.0,False,2026-01-15T12:54:41.824172,american tacos easy | american | american tacos | quick american tacos easy,4.4,45.0,Medium,,,,,,,,,,,
404.0,American Chicken,American,Lunch,Regular,"carrot, tomato, shrimp, mozzarella, cream, cinnamon",657.0,657.0,710.0,False,2026-02-24T12:54:41.824203,american chicken | american | quick american chicken,3.9,90.0,Medium,,,,,,,,,,,
405.0,Authentic Pork Salad,Spanish,Appetizer,Regular,"tomato, zucchini, onion, carrot, tofu, beef, cheddar, yogurt, oregano, cumin",505.0,505.0,535.0,False,2026-03-02T12:54:41.824231,authentic pork salad | authentic | authentic pork | authentic authentic pork salad,4.9,10.0,Hard,,,,,,,,,,,
406.0,Quick Breakfast Brazilian Soup,Chinese,Pasta,Regular,"garlic, zucchini, tofu, parmesan, garlic, ginger, cumin",839.0,839.0,841.0,False,2026-02-10T12:54:41.824264,quick breakfast brazilian soup | quick | quick breakfast | quick breakfast brazilian | easy quick breakfast brazilian soup,4.5,20.0,Hard,,,,,,,,,,,
407.0,Bell Pepper Pasta,Lebanese,Salad,Vegetarian,"zucchini, tomato, tofu, cheese, yogurt, cumin, basil",709.0,709.0,580.0,False,2026-03-03T12:54:41.824303,bell pepper pasta | bell | bell pepper | homemade bell pepper pasta,3.7,90.0,Easy,,,,,,,,,,,
408.0,Authentic Fish Soup,Asian,Beverage,Regular,"bell pepper, onion, lamb, tuna, cream, mozzarella, basil, thyme",627.0,931.0,622.0,True,2026-03-10T12:54:41.824341,authentic fish soup | authentic | authentic fish | easy authentic fish soup,3.8,25.0,Easy,,,,,,,,,,,
409.0,Greek Chicken,American,Snack,Vegan,"carrot, mushroom, broccoli, pork, lamb, cinnamon, cumin, garlic",484.0,609.0,388.0,True,2026-03-22T12:54:41.824370,greek chicken | greek | quick greek chicken,3.8,60.0,Hard,,,,,,,,,,,
410.0,Portuguese Tofu,Spanish,Snack,Regular,"mushroom, spinach, zucchini, turkey, tuna, mozzarella, thyme, basil, cumin",614.0,647.0,688.0,True,2026-03-10T12:54:41.824399,portuguese tofu | portuguese | quick portuguese tofu,4.4,90.0,Medium,,,,,,,,,,,
411.0,Easy Tuna Stir-fry,Asian,Breakfast,Regular,"cucumber, mushroom, spinach, salmon, chicken, yogurt, cheddar, paprika, garlic",408.0,408.0,340.0,False,2026-03-07T12:54:41.824431,easy tuna stir-fry | easy | easy tuna | homemade easy tuna stir-fry,4.4,60.0,Easy,,,,,,,,,,,
412.0,Quick Lunch American Bread,Italian,Snack,Keto,"carrot, cucumber, mushroom, fish, chicken, cheese, cumin",857.0,1004.0,985.0,True,2026-03-01T12:54:41.824461,quick lunch american bread | quick | quick lunch | quick lunch american | quick quick lunch american bread,4.2,45.0,Hard,,,,,,,,,,,
413.0,Garlic Dinner,Japanese,Pasta,Regular,"garlic, tomato, cucumber, onion, turkey, cream, paprika, cinnamon",440.0,440.0,424.0,False,2026-03-06T12:54:41.824489,garlic dinner | garlic | quick garlic dinner,4.9,15.0,Hard,,,,,,,,,,,
414.0,Lebanese Kebab Quick,Asian,Breakfast,Regular,"cucumber, tomato, broccoli, carrot, tuna, cheese, turmeric, ginger, basil",582.0,582.0,537.0,False,2026-02-22T12:54:41.824516,lebanese kebab quick | lebanese | lebanese kebab | best lebanese kebab quick,4.7,20.0,Easy,,,,,,,,,,,
415.0,Quick Dessert Turkish Cookies,Mexican,Appetizer,Regular,"broccoli, spinach, mushroom, bell pepper, beef, oregano, turmeric",701.0,701.0,668.0,False,2026-03-19T12:54:41.824544,quick dessert turkish cookies | quick | quick dessert | quick dessert turkish | easy quick dessert turkish cookies,4.2,15.0,Medium,,,,,,,,,,,
416.0,Zucchini Beverage,Asian,Salad,Regular,"garlic, cucumber, onion, zucchini, pork, tuna, cheese, cumin",407.0,407.0,393.0,False,2026-03-19T12:54:41.824573,zucchini beverage | zucchini | easy zucchini beverage,4.6,45.0,Medium,,,,,,,,,,,
417.0,Quick Pork Breakfast,Japanese,Pasta,Vegetarian,"mushroom, cucumber, fish, butter, cumin",756.0,756.0,714.0,False,2026-02-16T12:54:41.824599,quick pork breakfast | quick | quick pork | best quick pork breakfast,4.4,20.0,Easy,,,,,,,,,,,
418.0,Zucchini Appetizer,Japanese,Appetizer,Regular,"carrot, garlic, spinach, cucumber, pork, fish, parmesan, milk, thyme, oregano",474.0,624.0,495.0,True,2026-01-08T12:54:41.824633,zucchini appetizer | zucchini | best zucchini appetizer,4.8,15.0,Hard,,,,,,,,,,,
419.0,French Cake Quick,German,Dinner,Vegetarian,"cucumber, garlic, carrot, turkey, chicken, basil",588.0,588.0,595.0,False,2026-03-20T12:54:41.824660,french cake quick | french | french cake | homemade french cake quick,3.7,20.0,Medium,,,,,,,,,,,
420.0,Quick Dessert Asian Risotto,Indian,Breakfast,High-Protein,"onion, bell pepper, tuna, tofu, cinnamon, thyme, turmeric",904.0,1094.0,898.0,True,2026-03-12T12:54:41.824689,quick dessert asian risotto | quick | quick dessert | quick dessert asian | authentic quick dessert asian risotto,4.4,25.0,Hard,,,,,,,,,,,
421.0,Quick Soup Indian Stir-fry,French,Snack,Regular,"broccoli, zucchini, chicken, shrimp, butter, ginger",541.0,541.0,615.0,False,2026-02-19T12:54:41.824717,quick soup indian stir-fry | quick | quick soup | quick soup indian | quick quick soup indian stir-fry,4.5,45.0,Hard,,,,,,,,,,,
422.0,Vietnamese Curry Authentic,German,Appetizer,Regular,"mushroom, cucumber, tofu, cheese, parmesan, cinnamon, thyme",609.0,609.0,554.0,False,2026-02-17T12:54:41.824744,vietnamese curry authentic | vietnamese | vietnamese curry | best vietnamese curry authentic,4.0,30.0,Medium,,,,,,,,,,,
423.0,Onion Lunch,Portuguese,Appetizer,Regular,"spinach, onion, cucumber, broccoli, chicken, cinnamon",460.0,460.0,525.0,False,2026-01-30T12:54:41.824781,onion lunch | onion | best onion lunch,4.9,60.0,Easy,,,,,,,,,,,
424.0,Asian Tofu,Lebanese,Breakfast,Regular,"spinach, carrot, onion, shrimp, pork, ginger, cinnamon, garlic",885.0,885.0,914.0,False,2026-03-11T12:54:41.824808,asian tofu | asian | best asian tofu,4.1,20.0,Hard,,,,,,,,,,,
425.0,German Burger Fusion,American,Appetizer,High-Protein,"bell pepper, spinach, carrot, beef, tofu, milk, mozzarella, paprika, cinnamon, cumin",737.0,737.0,638.0,False,2026-03-08T12:54:41.824836,german burger fusion | german | german burger | homemade german burger fusion,4.1,10.0,Easy,,,,,,,,,,,
426.0,Japanese Salad,Greek,Dessert,Regular,"zucchini, tomato, spinach, cucumber, tofu, parmesan, garlic, paprika, thyme",766.0,1106.0,660.0,True,2026-03-10T12:54:41.824869,japanese salad | japanese | homemade japanese salad,3.5,25.0,Easy,,,,,,,,,,,
427.0,Easy Shrimp Gratin,German,Lunch,Regular,"zucchini, tomato, chicken, lamb, parmesan, cream, cinnamon, garlic",886.0,886.0,853.0,False,2026-03-20T12:54:41.824895,easy shrimp gratin | easy | easy shrimp | best easy shrimp gratin,4.0,60.0,Easy,,,,,,,,,,,
428.0,Portuguese Turkey,German,Appetizer,Regular,"garlic, cucumber, shrimp, turmeric, oregano",709.0,709.0,670.0,False,2026-02-23T12:54:41.824921,portuguese turkey | portuguese | authentic portuguese turkey,3.8,90.0,Hard,,,,,,,,,,,
429.0,Indian Burger Quick,Mexican,Breakfast,Regular,"mushroom, spinach, fish, turkey, cheddar, paprika",676.0,676.0,672.0,False,2026-03-18T12:54:41.824947,indian burger quick | indian | indian burger | best indian burger quick,3.5,90.0,Easy,,,,,,,,,,,
430.0,Tuna With Zucchini,Chinese,Snack,Regular,"onion, zucchini, chicken, parmesan, milk, cumin, turmeric",542.0,542.0,516.0,False,2025-12-13T12:54:41.824993,tuna with zucchini | tuna | tuna with | best tuna with zucchini,3.6,15.0,Easy,,,,,,,,,,,
431.0,Spanish Salad,American,Lunch,Regular,"carrot, bell pepper, tomato, garlic, beef, basil, ginger",636.0,643.0,625.0,True,2026-02-08T12:54:41.825025,spanish salad | spanish | homemade spanish salad,3.9,45.0,Hard,,,,,,,,,,,
432.0,Easy Tofu Curry,Turkish,Snack,Regular,"mushroom, broccoli, tomato, fish, pork, parmesan, paprika",634.0,634.0,749.0,False,2026-03-19T12:54:41.825057,easy tofu curry | easy | easy tofu | authentic easy tofu curry,4.0,60.0,Medium,,,,,,,,,,,
433.0,Quick Dessert Asian Salad,Caribbean,Dinner,Low-Carb,"onion, garlic, mushroom, shrimp, fish, garlic, basil, thyme",1000.0,1000.0,915.0,False,2025-11-18T12:54:41.825110,quick dessert asian salad | quick | quick dessert | quick dessert asian | authentic quick dessert asian salad,4.9,15.0,Medium,,,,,,,,,,,
434.0,Easy Beef Appetizer,German,Dinner,Low-Carb,"tomato, carrot, zucchini, cucumber, shrimp, cumin, paprika",825.0,825.0,772.0,False,2026-03-08T12:54:41.825144,easy beef appetizer | easy | easy beef | best easy beef appetizer,4.3,15.0,Easy,,,,,,,,,,,
435.0,Easy Shrimp Risotto,Lebanese,Dinner,Regular,"spinach, carrot, bell pepper, broccoli, tofu, fish, cheddar, milk, cinnamon, oregano",717.0,717.0,812.0,False,2026-02-07T12:54:41.825177,easy shrimp risotto | easy | easy shrimp | best easy shrimp risotto,4.2,30.0,Easy,,,,,,,,,,,
436.0,Greek Salad Easy,French,Soup,Regular,"spinach, carrot, zucchini, turkey, butter, garlic",662.0,662.0,581.0,False,2026-03-13T12:54:41.825209,greek salad easy | greek | greek salad | homemade greek salad easy,3.6,45.0,Hard,,,,,,,,,,,
437.0,Easy Chicken Soup,Turkish,Dessert,Regular,"mushroom, carrot, broccoli, garlic, pork, turkey, cheese, milk, ginger, cumin, garlic",865.0,865.0,812.0,False,2026-02-26T12:54:41.825265,easy chicken soup | easy | easy chicken | easy easy chicken soup,4.4,30.0,Hard,,,,,,,,,,,
438.0,Indian Pasta,Brazilian,Salad,Regular,"tomato, carrot, mushroom, onion, lamb, milk, cheese, cumin",595.0,727.0,592.0,True,2026-02-21T12:54:41.825308,indian pasta | indian | quick indian pasta,4.1,15.0,Hard,,,,,,,,,,,
439.0,Beef With Zucchini,Portuguese,Breakfast,Regular,"zucchini, tomato, bell pepper, tuna, lamb, butter, milk, cumin",665.0,665.0,637.0,False,2026-03-16T12:54:41.825336,beef with zucchini | beef | beef with | quick beef with zucchini,3.6,20.0,Hard,,,,,,,,,,,
440.0,Quick Soup Chinese Wrap,Turkish,Appetizer,Vegan,"onion, carrot, garlic, beef, lamb, thyme, turmeric",1000.0,1000.0,891.0,False,2026-02-27T12:54:41.825365,quick soup chinese wrap | quick | quick soup | quick soup chinese | easy quick soup chinese wrap,4.9,30.0,Medium,,,,,,,,,,,
441.0,Spanish Dinner,Chinese,Snack,Regular,"mushroom, garlic, spinach, zucchini, tofu, mozzarella, milk, turmeric, oregano, thyme",538.0,538.0,458.0,False,2026-01-20T12:54:41.825397,spanish dinner | spanish | best spanish dinner,4.7,60.0,Easy,,,,,,,,,,,
442.0,Modern Tuna Salad,Thai,Snack,High-Protein,"garlic, spinach, broccoli, zucchini, fish, cinnamon, ginger, basil",720.0,1005.0,828.0,True,2026-03-13T12:54:41.825427,modern tuna salad | modern | modern tuna | homemade modern tuna salad,4.9,45.0,Easy,,,,,,,,,,,
443.0,Quick Dinner Indian Stir-fry,Lebanese,Lunch,Vegetarian,"zucchini, onion, pork, butter, ginger, thyme, cinnamon",661.0,661.0,757.0,False,2026-03-03T12:54:41.825456,quick dinner indian stir-fry | quick | quick dinner | quick dinner indian | authentic quick dinner indian stir-fry,4.4,25.0,Easy,,,,,,,,,,,
444.0,Easy Shrimp Kebab,French,Soup,Regular,"broccoli, spinach, bell pepper, cucumber, chicken, cheddar, garlic, cinnamon, turmeric",514.0,514.0,452.0,False,2026-03-12T12:54:41.825487,easy shrimp kebab | easy | easy shrimp | quick easy shrimp kebab,4.6,90.0,Easy,,,,,,,,,,,
445.0,Quick Soup American Risotto,German,Beverage,Regular,"spinach, tomato, carrot, broccoli, lamb, garlic",871.0,871.0,998.0,False,2026-02-25T12:54:41.825515,quick soup american risotto | quick | quick soup | quick soup american | best quick soup american risotto,5.0,10.0,Easy,,,,,,,,,,,
446.0,Easy Tofu Tacos,Asian,Soup,Keto,"mushroom, carrot, garlic, cucumber, salmon, butter, yogurt, oregano, cumin",327.0,327.0,361.0,False,2026-01-29T12:54:41.825546,easy tofu tacos | easy | easy tofu | easy easy tofu tacos,4.4,45.0,Medium,,,,,,,,,,,
447.0,Easy Chicken Kebab,Mexican,Dessert,Regular,"cucumber, broccoli, onion, mushroom, tuna, beef, parmesan, butter, cumin, cinnamon",1000.0,1000.0,1153.0,False,2026-03-21T12:54:41.825573,easy chicken kebab | easy | easy chicken | easy easy chicken kebab,4.2,90.0,Hard,,,,,,,,,,,
448.0,Quick Beverage Spanish Burger,Mexican,Breakfast,Keto,"garlic, broccoli, zucchini, mushroom, turkey, pork, cheddar, turmeric, cinnamon, paprika",649.0,649.0,759.0,False,2026-02-21T12:54:41.825601,quick beverage spanish burger | quick | quick beverage | quick beverage spanish | easy quick beverage spanish burger,3.5,45.0,Medium,,,,,,,,,,,
449.0,Quick Beverage Greek Burger,Italian,Dessert,Dairy-Free,"cucumber, broccoli, mushroom, garlic, chicken, cumin",973.0,973.0,830.0,False,2026-02-15T12:54:41.825628,quick beverage greek burger | quick | quick beverage | quick beverage greek | quick quick beverage greek burger,3.9,90.0,Easy,,,,,,,,,,,
450.0,Portuguese Beef,Brazilian,Dessert,Nut-Free,"onion, bell pepper, zucchini, cucumber, tofu, salmon, milk, oregano, basil, ginger",463.0,463.0,422.0,False,2026-02-02T12:54:41.825659,portuguese beef | portuguese | authentic portuguese beef,3.8,15.0,Easy,,,,,,,,,,,
451.0,Caribbean Shrimp,Spanish,Dinner,Regular,"zucchini, cucumber, spinach, broccoli, chicken, shrimp, cheddar, cinnamon, cumin",419.0,573.0,459.0,True,2026-01-28T12:54:41.825692,caribbean shrimp | caribbean | best caribbean shrimp,3.7,60.0,Medium,,,,,,,,,,,
452.0,Portuguese Beverage,Portuguese,Dinner,Dairy-Free,"carrot, broccoli, chicken, tofu, paprika, cumin",628.0,628.0,667.0,False,2026-02-07T12:54:41.825717,portuguese beverage | portuguese | best portuguese beverage,4.6,60.0,Medium,,,,,,,,,,,
453.0,Easy Lamb Risotto,Lebanese,Appetizer,Regular,"carrot, onion, garlic, broccoli, tofu, shrimp, yogurt, cheddar, cumin, cinnamon, turmeric",742.0,922.0,714.0,True,2026-03-20T12:54:41.825751,easy lamb risotto | easy | easy lamb | authentic easy lamb risotto,4.1,45.0,Medium,,,,,,,,,,,
454.0,German Chicken,Mexican,Snack,Nut-Free,"bell pepper, garlic, broccoli, carrot, shrimp, mozzarella, cheese, turmeric, oregano",870.0,1021.0,977.0,True,2026-03-19T12:54:41.825780,german chicken | german | best german chicken,4.9,30.0,Medium,,,,,,,,,,,
455.0,Vietnamese Pork,Indian,Breakfast,Gluten-Free,"zucchini, onion, broccoli, carrot, chicken, yogurt, cream, basil",215.0,268.0,232.0,True,2026-02-03T12:54:41.825809,vietnamese pork | vietnamese | authentic vietnamese pork,3.6,10.0,Hard,,,,,,,,,,,
456.0,Quick Lunch Spanish Sandwich,Caribbean,Lunch,Regular,"cucumber, onion, garlic, turkey, cream, basil",711.0,854.0,634.0,True,2026-03-12T12:54:41.825841,quick lunch spanish sandwich | quick | quick lunch | quick lunch spanish | authentic quick lunch spanish sandwich,3.9,45.0,Medium,,,,,,,,,,,
457.0,Spanish Curry Easy,Spanish,Breakfast,Regular,"broccoli, spinach, bell pepper, garlic, salmon, tuna, mozzarella, butter, cumin, turmeric",814.0,814.0,724.0,False,2026-03-03T12:54:41.825869,spanish curry easy | spanish | spanish curry | homemade spanish curry easy,4.5,15.0,Easy,,,,,,,,,,,
458.0,Quick Pasta Caribbean Gratin,American,Soup,Regular,"bell pepper, carrot, cucumber, fish, tofu, basil, cinnamon",875.0,875.0,825.0,False,2026-02-23T12:54:41.825899,quick pasta caribbean gratin | quick | quick pasta | quick pasta caribbean | quick quick pasta caribbean gratin,4.5,90.0,Hard,,,,,,,,,,,
459.0,Spanish Bowl Quick,Spanish,Salad,Regular,"bell pepper, tomato, cucumber, tuna, pork, yogurt, cheddar, basil, garlic",227.0,227.0,188.0,False,2026-02-21T12:54:41.825927,spanish bowl quick | spanish | spanish bowl | easy spanish bowl quick,4.5,15.0,Medium,,,,,,,,,,,
460.0,Caribbean Kebab Easy,German,Breakfast,Regular,"carrot, mushroom, zucchini, pork, cumin, turmeric",717.0,972.0,804.0,True,2026-01-30T12:54:41.825956,caribbean kebab easy | caribbean | caribbean kebab | easy caribbean kebab easy,4.3,20.0,Hard,,,,,,,,,,,
461.0,French Burger Modern,Indian,Snack,High-Protein,"cucumber, spinach, broccoli, zucchini, lamb, turkey, parmesan, mozzarella, oregano, ginger",326.0,326.0,325.0,False,2026-03-13T12:54:41.825983,french burger modern | french | french burger | quick french burger modern,3.9,20.0,Hard,,,,,,,,,,,
462.0,Greek Salad Quick,Vietnamese,Appetizer,Regular,"cucumber, mushroom, shrimp, tofu, mozzarella, turmeric",839.0,1103.0,922.0,True,2026-03-21T12:54:41.826016,greek salad quick | greek | greek salad | easy greek salad quick,4.0,25.0,Medium,,,,,,,,,,,
463.0,Easy Lamb Tacos,Lebanese,Pasta,Regular,"carrot, tomato, spinach, zucchini, chicken, cheese, yogurt, paprika, cumin, garlic",690.0,785.0,569.0,True,2026-02-14T12:54:41.826056,easy lamb tacos | easy | easy lamb | easy easy lamb tacos,4.8,45.0,Easy,,,,,,,,,,,
464.0,Lebanese Tofu,Greek,Dinner,Regular,"mushroom, spinach, onion, turkey, garlic, basil, cinnamon",498.0,559.0,461.0,True,2026-02-10T12:54:41.826115,lebanese tofu | lebanese | authentic lebanese tofu,3.7,10.0,Hard,,,,,,,,,,,
465.0,Vietnamese Dinner,Lebanese,Salad,Regular,"zucchini, carrot, fish, butter, yogurt, paprika, cumin, garlic",298.0,298.0,332.0,False,2026-03-11T12:54:41.826143,vietnamese dinner | vietnamese | easy vietnamese dinner,4.8,90.0,Hard,,,,,,,,,,,
466.0,Quick Breakfast Chinese Cookies,Spanish,Salad,Regular,"carrot, zucchini, turkey, tofu, parmesan, cream, paprika",557.0,557.0,529.0,False,2026-01-09T12:54:41.826174,quick breakfast chinese cookies | quick | quick breakfast | quick breakfast chinese | easy quick breakfast chinese cookies,4.9,30.0,Medium,,,,,,,,,,,
467.0,Fusion Turkey Dessert,Greek,Lunch,High-Protein,"tomato, zucchini, mushroom, fish, chicken, yogurt, paprika, thyme, cumin",539.0,539.0,567.0,False,2026-03-08T12:54:41.826203,fusion turkey dessert | fusion | fusion turkey | authentic fusion turkey dessert,4.6,45.0,Medium,,,,,,,,,,,
468.0,Garlic Beverage,Mexican,Appetizer,Nut-Free,"onion, broccoli, lamb, turkey, turmeric, paprika, thyme",412.0,446.0,439.0,True,2026-02-13T12:54:41.826236,garlic beverage | garlic | easy garlic beverage,4.9,45.0,Easy,,,,,,,,,,,
469.0,Italian Beverage,Mexican,Soup,Regular,"bell pepper, tomato, garlic, zucchini, shrimp, basil, thyme",341.0,474.0,279.0,True,2026-02-20T12:54:41.826266,italian beverage | italian | quick italian beverage,4.0,25.0,Easy,,,,,,,,,,,
470.0,Lebanese Lunch,Asian,Lunch,Vegan,"garlic, broccoli, mushroom, onion, beef, thyme, paprika, garlic",658.0,658.0,640.0,False,2026-03-02T12:54:41.826304,lebanese lunch | lebanese | authentic lebanese lunch,4.2,30.0,Medium,,,,,,,,,,,
471.0,Caribbean Sandwich Traditional,Indian,Appetizer,Regular,"garlic, spinach, bell pepper, salmon, shrimp, yogurt, garlic, paprika, ginger",417.0,417.0,461.0,False,2026-03-21T12:54:41.826332,caribbean sandwich traditional | caribbean | caribbean sandwich | easy caribbean sandwich traditional,4.1,90.0,Hard,,,,,,,,,,,
472.0,Spanish Burger Authentic,Portuguese,Dessert,Regular,"cucumber, spinach, carrot, pork, beef, turmeric, paprika, thyme",316.0,316.0,279.0,False,2026-01-25T12:54:41.826359,spanish burger authentic | spanish | spanish burger | homemade spanish burger authentic,4.5,25.0,Easy,,,,,,,,,,,
473.0,Portuguese Lamb,American,Appetizer,Regular,"onion, tomato, broccoli, mushroom, chicken, shrimp, milk, cheddar, ginger, garlic, turmeric",655.0,876.0,601.0,True,2026-02-22T12:54:41.826390,portuguese lamb | portuguese | quick portuguese lamb,3.7,45.0,Medium,,,,,,,,,,,
474.0,Quick Beef Soup,Portuguese,Dinner,Regular,"spinach, tomato, bell pepper, zucchini, chicken, parmesan, garlic",823.0,823.0,762.0,False,2026-02-10T12:54:41.826417,quick beef soup | quick | quick beef | homemade quick beef soup,4.5,20.0,Hard,,,,,,,,,,,
475.0,Portuguese Bread Modern,Lebanese,Soup,High-Protein,"cucumber, tomato, mushroom, salmon, fish, mozzarella, yogurt, oregano, ginger, paprika",892.0,1289.0,844.0,True,2026-03-12T12:54:41.826447,portuguese bread modern | portuguese | portuguese bread | quick portuguese bread modern,3.6,45.0,Hard,,,,,,,,,,,
476.0,Chinese Lamb,Chinese,Dinner,Regular,"carrot, bell pepper, beef, parmesan, cream, cumin",385.0,484.0,436.0,True,2026-03-13T12:54:41.826477,chinese lamb | chinese | authentic chinese lamb,3.5,90.0,Hard,,,,,,,,,,,
477.0,Asian Salmon,Japanese,Appetizer,Regular,"carrot, onion, garlic, tomato, beef, cream, cheese, paprika, oregano, cinnamon",441.0,468.0,439.0,True,2026-03-06T12:54:41.826506,asian salmon | asian | best asian salmon,4.1,15.0,Easy,,,,,,,,,,,
478.0,Greek Salad Fusion,Japanese,Dinner,Regular,"spinach, tomato, pork, cheese, cinnamon, cumin",479.0,479.0,385.0,False,2026-02-23T12:54:41.826533,greek salad fusion | greek | greek salad | quick greek salad fusion,4.2,90.0,Medium,,,,,,,,,,,
479.0,Classic Salmon Appetizer,Portuguese,Beverage,Regular,"mushroom, onion, spinach, pork, yogurt, mozzarella, thyme",503.0,503.0,558.0,False,2026-03-11T12:54:41.826560,classic salmon appetizer | classic | classic salmon | authentic classic salmon appetizer,4.7,90.0,Medium,,,,,,,,,,,
480.0,Easy Turkey Tacos,Spanish,Salad,High-Protein,"bell pepper, mushroom, cucumber, tofu, pork, cheese, butter, basil, paprika",772.0,772.0,656.0,False,2025-12-01T12:54:41.826587,easy turkey tacos | easy | easy turkey | easy easy turkey tacos,3.5,30.0,Medium,,,,,,,,,,,
481.0,Salmon With Broccoli,Lebanese,Salad,Regular,"carrot, cucumber, broccoli, mushroom, lamb, parmesan, milk, ginger",600.0,679.0,550.0,True,2026-03-22T12:54:41.826619,salmon with broccoli | salmon | salmon with | authentic salmon with broccoli,4.7,15.0,Easy,,,,,,,,,,,
482.0,Tomato Pasta,French,Lunch,Regular,"broccoli, onion, spinach, garlic, fish, chicken, mozzarella, turmeric, basil, oregano",813.0,813.0,771.0,False,2026-03-10T12:54:41.826646,tomato pasta | tomato | easy tomato pasta,3.5,60.0,Medium,,,,,,,,,,,
483.0,Asian Dessert,Chinese,Salad,Regular,"bell pepper, mushroom, garlic, spinach, shrimp, mozzarella, basil",818.0,818.0,662.0,False,2026-01-25T12:54:41.826672,asian dessert | asian | homemade asian dessert,4.8,15.0,Hard,,,,,,,,,,,
484.0,Easy Beef Lunch,Greek,Pasta,Regular,"bell pepper, onion, beef, fish, milk, turmeric, oregano, cumin",487.0,487.0,478.0,False,2026-02-05T12:54:41.826699,easy beef lunch | easy | easy beef | homemade easy beef lunch,4.1,30.0,Easy,,,,,,,,,,,
485.0,Easy Shrimp Sandwich,Asian,Salad,High-Protein,"onion, mushroom, zucchini, chicken, cheddar, butter, paprika, thyme, turmeric",630.0,707.0,692.0,True,2026-03-03T12:54:41.826733,easy shrimp sandwich | easy | easy shrimp | best easy shrimp sandwich,4.2,25.0,Medium,,,,,,,,,,,
486.0,Easy Salmon Wrap,German,Pasta,Regular,"garlic, broccoli, onion, zucchini, tofu, thyme",663.0,980.0,738.0,True,2025-12-27T12:54:41.826768,easy salmon wrap | easy | easy salmon | homemade easy salmon wrap,5.0,45.0,Medium,,,,,,,,,,,
487.0,Shrimp With Tomato,Italian,Salad,Nut-Free,"garlic, cucumber, zucchini, mushroom, shrimp, mozzarella, yogurt, ginger, thyme",580.0,686.0,509.0,True,2026-03-15T12:54:41.826798,shrimp with tomato | shrimp | shrimp with | best shrimp with tomato,3.7,10.0,Easy,,,,,,,,,,,
488.0,Thai Chicken,Spanish,Salad,Regular,"broccoli, tomato, bell pepper, shrimp, butter, paprika",862.0,862.0,888.0,False,2026-02-05T12:54:41.826833,thai chicken | thai | quick thai chicken,3.7,60.0,Easy,,,,,,,,,,,
489.0,Quick Soup Thai Wrap,Spanish,Lunch,Nut-Free,"garlic, bell pepper, zucchini, onion, lamb, fish, turmeric, basil",1000.0,1000.0,903.0,False,2026-02-17T12:54:41.826861,quick soup thai wrap | quick | quick soup | quick soup thai | quick quick soup thai wrap,4.0,60.0,Medium,,,,,,,,,,,
