recipe_id,recipe_name,cuisine,category,dietary_type,ingredients,popularity_score,trending_score,search_count,is_trending,last_searched,common_searches,rating,prep_time_minutes,difficulty,id,course,diet,view_count,like_count,save_count,is_premium,created_at,search_tags,prep_time,difficulty_level
588.0,Turkish Pasta,Asian,Dessert,Regular,"broccoli, garlic, turkey, turmeric, paprika",697.0,697.0,618.0,False,2026-03-22T12:54:41.829976,turkish pasta | turkish | best turkish pasta,4.5,90.0,Easy,,,,,,,,,,,
589.0,Authentic Pork Lunch,German,Salad,High-Protein,"broccoli, mushroom, onion, turkey, cheese, thyme, garlic",469.0,469.0,478.0,False,2026-02-06T12:54:41.830005,authentic pork lunch | authentic | authentic pork | easy authentic pork lunch,3.6,15.0,Easy,,,,,,,,,,,
590.0,Easy Turkey Burger,Indian,Breakfast,Regular,"tomato, bell pepper, zucchini, onion, salmon, shrimp, butter, turmeric, thyme, cumin",689.0,689.0,766.0,False,2026-02-24T12:54:41.830031,easy turkey burger | easy | easy turkey | authentic easy turkey burger,4.6,10.0,Easy,,,,,,,,,,,
591.0,Quick Appetizer Thai Curry,Mexican,Soup,Regular,"carrot, mushroom, broccoli, tomato, tofu, paprika, garlic",837.0,1117.0,918.0,True,2026-02-21T12:54:41.830138,quick appetizer thai curry | quick | quick appetizer | quick appetizer thai | homemade quick appetizer thai curry,3.8,90.0,Medium,,,,,,,,,,,
592.0,Caribbean Beef,Chinese,Dessert,Dairy-Free,"bell pepper, carrot, garlic, turkey, basil",711.0,1027.0,827.0,True,2026-02-09T12:54:41.830179,caribbean beef | caribbean | homemade caribbean beef,4.6,10.0,Easy,,,,,,,,,,,
593.0,Bell Pepper Salad,Caribbean,Beverage,Regular,"mushroom, carrot, zucchini, garlic, turkey, cheese, milk, garlic",904.0,904.0,951.0,False,2026-02-25T12:54:41.830208,bell pepper salad | bell | bell pepper | easy bell pepper salad,3.7,20.0,Hard,,,,,,,,,,,
594.0,Spanish Appetizer,Turkish,Soup,Regular,"mushroom, zucchini, garlic, lamb, butter, ginger, basil, oregano",660.0,660.0,599.0,False,2026-02-13T12:54:41.830236,spanish appetizer | spanish | authentic spanish appetizer,3.8,15.0,Medium,,,,,,,,,,,
595.0,Onion Pasta,Greek,Soup,Regular,"cucumber, garlic, bell pepper, shrimp, basil, garlic, cinnamon",561.0,680.0,562.0,True,2026-01-10T12:54:41.830269,onion pasta | onion | homemade onion pasta,3.8,20.0,Easy,,,,,,,,,,,
596.0,Easy Tuna Tacos,Spanish,Dessert,Regular,"carrot, zucchini, onion, spinach, tuna, beef, butter, garlic, thyme",572.0,771.0,645.0,True,2026-03-08T12:54:41.830309,easy tuna tacos | easy | easy tuna | easy easy tuna tacos,4.5,15.0,Easy,,,,,,,,,,,
597.0,Easy Salmon Salad,Japanese,Appetizer,Regular,"zucchini, spinach, cucumber, bell pepper, tofu, beef, cinnamon",741.0,741.0,871.0,False,2026-03-13T12:54:41.830336,easy salmon salad | easy | easy salmon | best easy salmon salad,4.5,10.0,Easy,,,,,,,,,,,
598.0,Chicken With Cucumber,Indian,Snack,Regular,"bell pepper, cucumber, mushroom, salmon, tofu, cumin",838.0,838.0,734.0,False,2026-03-13T12:54:41.830367,chicken with cucumber | chicken | chicken with | authentic chicken with cucumber,4.5,45.0,Easy,,,,,,,,,,,
599.0,Portuguese Salmon,Asian,Pasta,Regular,"spinach, bell pepper, fish, tuna, cream, paprika",569.0,757.0,632.0,True,2026-01-31T12:54:41.830398,portuguese salmon | portuguese | best portuguese salmon,4.6,15.0,Easy,,,,,,,,,,,
600.0,Quick Beverage Turkish Cookies,Japanese,Dessert,Regular,"zucchini, cucumber, tomato, tuna, turkey, oregano, paprika, basil",474.0,494.0,449.0,True,2026-02-14T12:54:41.830428,quick beverage turkish cookies | quick | quick beverage | quick beverage turkish | homemade quick beverage turkish cookies,4.1,60.0,Hard,,,,,,,,,,,
601.0,Quick Dinner Spanish Cookies,Portuguese,Dessert,Regular,"garlic, carrot, bell pepper, fish, turkey, parmesan, cheese, paprika, cinnamon, garlic",732.0,976.0,848.0,True,2026-03-11T12:54:41.830464,quick dinner spanish cookies | quick | quick dinner | quick dinner spanish | easy quick dinner spanish cookies,4.8,60.0,Hard,,,,,,,,,,,
602.0,Asian Burger Modern,Spanish,Appetizer,Regular,"bell pepper, mushroom, chicken, mozzarella, paprika",435.0,435.0,521.0,False,2026-01-12T12:54:41.830495,asian burger modern | asian | asian burger | easy asian burger modern,4.7,20.0,Easy,,,,,,,,,,,
603.0,Easy Shrimp Burger,Turkish,Dinner,Regular,"cucumber, broccoli, shrimp, parmesan, milk, paprika",619.0,619.0,518.0,False,2026-03-20T12:54:41.830525,easy shrimp burger | easy | easy shrimp | easy easy shrimp burger,5.0,25.0,Hard,,,,,,,,,,,
604.0,Thai Risotto Easy,Vietnamese,Pasta,High-Protein,"zucchini, bell pepper, cucumber, beef, milk, butter, cumin, cinnamon, paprika",931.0,931.0,1045.0,False,2026-02-09T12:54:41.830564,thai risotto easy | thai | thai risotto | quick thai risotto easy,4.8,10.0,Medium,,,,,,,,,,,
605.0,Fusion Turkey Salad,Caribbean,Snack,Regular,"garlic, tomato, zucchini, spinach, fish, basil, oregano, cumin",635.0,642.0,707.0,True,2026-03-09T12:54:41.830595,fusion turkey salad | fusion | fusion turkey | authentic fusion turkey salad,4.3,60.0,Medium,,,,,,,,,,,
606.0,Turkish Wrap Traditional,Italian,Dessert,Dairy-Free,"zucchini, tomato, turkey, fish, cumin",424.0,424.0,378.0,False,2026-02-19T12:54:41.830623,turkish wrap traditional | turkish | turkish wrap | quick turkish wrap traditional,3.5,90.0,Medium,,,,,,,,,,,
607.0,Fusion Lamb Salad,Thai,Beverage,Regular,"spinach, carrot, chicken, tofu, cheddar, thyme, cinnamon, oregano",743.0,743.0,843.0,False,2026-03-21T12:54:41.830650,fusion lamb salad | fusion | fusion lamb | best fusion lamb salad,4.4,45.0,Hard,,,,,,,,,,,
608.0,Traditional Beef Salad,Turkish,Soup,Regular,"tomato, mushroom, chicken, tuna, milk, mozzarella, basil, cumin, paprika",849.0,849.0,972.0,False,2026-02-21T12:54:41.830679,traditional beef salad | traditional | traditional beef | homemade traditional beef salad,4.4,45.0,Hard,,,,,,,,,,,
609.0,Authentic Tofu Pasta,Caribbean,Pasta,Regular,"garlic, mushroom, broccoli, pork, mozzarella, ginger, oregano, cinnamon",746.0,746.0,807.0,False,2026-03-05T12:54:41.830707,authentic tofu pasta | authentic | authentic tofu | quick authentic tofu pasta,4.1,25.0,Easy,,,,,,,,,,,
610.0,Lebanese Stew Modern,Italian,Dinner,Regular,"bell pepper, garlic, tomato, cucumber, fish, chicken, cumin",503.0,653.0,589.0,True,2026-01-02T12:54:41.830736,lebanese stew modern | lebanese | lebanese stew | best lebanese stew modern,4.0,90.0,Easy,,,,,,,,,,,
611.0,Quick Dinner German Stir-fry,Greek,Pasta,Regular,"cucumber, mushroom, onion, salmon, pork, yogurt, cheddar, paprika, garlic, thyme",459.0,459.0,486.0,False,2025-11-23T12:54:41.830765,quick dinner german stir-fry | quick | quick dinner | quick dinner german | easy quick dinner german stir-fry,4.7,60.0,Medium,,,,,,,,,,,
612.0,Quick Dinner German Bowl,French,Beverage,Dairy-Free,"carrot, spinach, bell pepper, tuna, cinnamon, basil",701.0,701.0,575.0,False,2026-02-24T12:54:41.830799,quick dinner german bowl | quick | quick dinner | quick dinner german | easy quick dinner german bowl,4.2,60.0,Medium,,,,,,,,,,,
613.0,Thai Pie Healthy,Indian,Appetizer,Regular,"garlic, bell pepper, cucumber, fish, shrimp, turmeric, basil, cinnamon",1000.0,1000.0,866.0,False,2025-12-27T12:54:41.830827,thai pie healthy | thai | thai pie | authentic thai pie healthy,4.3,45.0,Hard,,,,,,,,,,,
614.0,Asian Curry Easy,Brazilian,Beverage,Regular,"tomato, broccoli, mushroom, bell pepper, chicken, basil, garlic",1000.0,1000.0,1059.0,False,2026-02-15T12:54:41.830854,asian curry easy | asian | asian curry | authentic asian curry easy,3.9,15.0,Easy,,,,,,,,,,,
615.0,Turkish Beef,Italian,Dessert,Regular,"spinach, carrot, mushroom, tuna, cream, ginger",560.0,560.0,605.0,False,2026-03-17T12:54:41.830882,turkish beef | turkish | authentic turkish beef,4.2,30.0,Easy,,,,,,,,,,,
616.0,Fish With Carrot,Greek,Dinner,Regular,"mushroom, carrot, cucumber, turkey, fish, mozzarella, paprika",346.0,346.0,300.0,False,2026-01-27T12:54:41.830911,fish with carrot | fish | fish with | homemade fish with carrot,3.5,20.0,Hard,,,,,,,,,,,
617.0,Mexican Chicken,Indian,Salad,Regular,"spinach, carrot, onion, zucchini, tuna, fish, parmesan, milk, cinnamon, oregano",788.0,788.0,883.0,False,2026-01-27T12:54:41.830937,mexican chicken | mexican | quick mexican chicken,4.9,90.0,Hard,,,,,,,,,,,
618.0,Mexican Appetizer,Portuguese,Snack,Regular,"garlic, onion, tomato, pork, cheddar, ginger",699.0,699.0,671.0,False,2026-03-02T12:54:41.830967,mexican appetizer | mexican | best mexican appetizer,3.7,20.0,Easy,,,,,,,,,,,
619.0,French Chicken,Greek,Breakfast,Regular,"bell pepper, cucumber, tomato, zucchini, salmon, turkey, milk, parmesan, cumin, ginger, basil",461.0,461.0,478.0,False,2026-02-24T12:54:41.830998,french chicken | french | authentic french chicken,4.0,30.0,Hard,,,,,,,,,,,
620.0,Quick Appetizer German Burger,Portuguese,Appetizer,Vegetarian,"broccoli, bell pepper, fish, turkey, cumin, cinnamon",760.0,772.0,633.0,True,2026-03-06T12:54:41.831036,quick appetizer german burger | quick | quick appetizer | quick appetizer german | best quick appetizer german burger,4.4,60.0,Easy,,,,,,,,,,,
621.0,Easy Tuna Soup,Vietnamese,Beverage,Regular,"bell pepper, broccoli, garlic, mushroom, fish, lamb, turmeric",675.0,675.0,593.0,False,2026-01-16T12:54:41.831065,easy tuna soup | easy | easy tuna | best easy tuna soup,4.6,20.0,Hard,,,,,,,,,,,
622.0,Mushroom Appetizer,Thai,Lunch,Regular,"carrot, tomato, lamb, butter, garlic, ginger, oregano",593.0,830.0,481.0,True,2025-09-27T12:54:41.831119,mushroom appetizer | mushroom | easy mushroom appetizer,4.8,90.0,Hard,,,,,,,,,,,
623.0,Quick Appetizer Brazilian Stir-fry,Chinese,Dinner,Regular,"mushroom, bell pepper, zucchini, garlic, chicken, tofu, cheddar, garlic",723.0,723.0,596.0,False,2026-01-25T12:54:41.831153,quick appetizer brazilian stir-fry | quick | quick appetizer | quick appetizer brazilian | homemade quick appetizer brazilian stir-fry,4.0,25.0,Easy,,,,,,,,,,,
624.0,Quick Pasta American Wrap,Portuguese,Snack,Regular,"broccoli, zucchini, chicken, mozzarella, cheese, basil, garlic, paprika",916.0,1362.0,1045.0,True,2026-01-31T12:54:41.831184,quick pasta american wrap | quick | quick pasta | quick pasta american | easy quick pasta american wrap,4.9,45.0,Medium,,,,,,,,,,,
625.0,Tuna With Mushroom,American,Salad,Regular,"broccoli, onion, bell pepper, tomato, shrimp, chicken, oregano",469.0,518.0,463.0,True,2026-03-15T12:54:41.831214,tuna with mushroom | tuna | tuna with | quick tuna with mushroom,3.9,30.0,Medium,,,,,,,,,,,
626.0,Lebanese Turkey,Asian,Salad,Low-Carb,"garlic, broccoli, mushroom, tofu, pork, butter, cheddar, garlic",388.0,420.0,461.0,True,2026-03-18T12:54:41.831246,lebanese turkey | lebanese | authentic lebanese turkey,4.6,15.0,Medium,,,,,,,,,,,
627.0,Tofu With Onion,Japanese,Pasta,Regular,"carrot, cucumber, salmon, yogurt, parmesan, oregano, cinnamon, paprika",490.0,685.0,450.0,True,2026-03-11T12:54:41.831274,tofu with onion | tofu | tofu with | easy tofu with onion,3.8,30.0,Medium,,,,,,,,,,,
628.0,Chicken With Tomato,Italian,Lunch,Regular,"onion, garlic, spinach, pork, salmon, basil",781.0,881.0,835.0,True,2026-03-09T12:54:41.831308,chicken with tomato | chicken | chicken with | quick chicken with tomato,3.6,20.0,Hard,,,,,,,,,,,
629.0,Italian Kebab Fusion,Brazilian,Dessert,Regular,"cucumber, garlic, salmon, mozzarella, thyme",589.0,689.0,507.0,True,2026-01-22T12:54:41.831341,italian kebab fusion | italian | italian kebab | authentic italian kebab fusion,3.6,60.0,Hard,,,,,,,,,,,
630.0,Easy Tuna Bread,American,Breakfast,Regular,"bell pepper, carrot, tomato, mushroom, tuna, paprika, turmeric, basil",766.0,766.0,785.0,False,2026-03-12T12:54:41.831368,easy tuna bread | easy | easy tuna | easy easy tuna bread,4.7,25.0,Easy,,,,,,,,,,,
631.0,Asian Beverage,Italian,Dessert,Vegan,"garlic, spinach, fish, lamb, turmeric",705.0,705.0,739.0,False,2026-03-18T12:54:41.831396,asian beverage | asian | easy asian beverage,3.9,45.0,Medium,,,,,,,,,,,
632.0,Portuguese Kebab Easy,Japanese,Beverage,Regular,"bell pepper, zucchini, mushroom, tomato, chicken, shrimp, ginger, turmeric",530.0,530.0,521.0,False,2026-03-20T12:54:41.831423,portuguese kebab easy | portuguese | portuguese kebab | easy portuguese kebab easy,4.0,10.0,Hard,,,,,,,,,,,
633.0,Modern Fish Appetizer,Thai,Appetizer,Regular,"broccoli, zucchini, spinach, tofu, shrimp, milk, parmesan, oregano",322.0,322.0,343.0,False,2026-02-25T12:54:41.831449,modern fish appetizer | modern | modern fish | homemade modern fish appetizer,4.7,60.0,Medium,,,,,,,,,,,
634.0,American Lamb,American,Beverage,Keto,"tomato, spinach, carrot, onion, salmon, shrimp, butter, cream, garlic, oregano, basil",151.0,151.0,153.0,False,2026-03-11T12:54:41.831476,american lamb | american | homemade american lamb,4.8,10.0,Easy,,,,,,,,,,,
635.0,Lebanese Cookies Healthy,Indian,Beverage,Nut-Free,"bell pepper, onion, tofu, parmesan, garlic",507.0,507.0,505.0,False,2026-02-10T12:54:41.831515,lebanese cookies healthy | lebanese | lebanese cookies | best lebanese cookies healthy,4.2,90.0,Easy,,,,,,,,,,,
636.0,Brazilian Risotto Traditional,French,Breakfast,Regular,"mushroom, spinach, cucumber, pork, fish, milk, butter, cinnamon, cumin",425.0,425.0,486.0,False,2026-03-09T12:54:41.831547,brazilian risotto traditional | brazilian | brazilian risotto | best brazilian risotto traditional,4.1,10.0,Hard,,,,,,,,,,,
637.0,American Appetizer,Japanese,Beverage,Regular,"mushroom, bell pepper, chicken, turkey, mozzarella, cream, garlic, turmeric",421.0,421.0,369.0,False,2026-03-18T12:54:41.831582,american appetizer | american | easy american appetizer,4.9,15.0,Hard,,,,,,,,,,,
638.0,Lebanese Dessert,Chinese,Dessert,Regular,"carrot, zucchini, lamb, turmeric, cumin, ginger",205.0,263.0,204.0,True,2026-02-25T12:54:41.831610,lebanese dessert | lebanese | quick lebanese dessert,4.5,45.0,Hard,,,,,,,,,,,
639.0,Pork With Carrot,German,Dinner,Regular,"tomato, zucchini, carrot, shrimp, fish, cheese, butter, oregano, thyme",544.0,544.0,465.0,False,2026-02-18T12:54:41.831648,pork with carrot | pork | pork with | authentic pork with carrot,4.4,90.0,Easy,,,,,,,,,,,
640.0,Thai Burger Easy,Vietnamese,Breakfast,Regular,"mushroom, spinach, onion, carrot, shrimp, mozzarella, turmeric, garlic, cumin",607.0,691.0,529.0,True,2026-03-15T12:54:41.831682,thai burger easy | thai | thai burger | homemade thai burger easy,4.7,90.0,Easy,,,,,,,,,,,
641.0,Vietnamese Salmon,French,Soup,Vegan,"zucchini, tomato, carrot, chicken, tuna, cumin",557.0,557.0,477.0,False,2026-02-25T12:54:41.831707,vietnamese salmon | vietnamese | easy vietnamese salmon,4.1,10.0,Easy,,,,,,,,,,,
642.0,Tofu With Broccoli,Spanish,Snack,Dairy-Free,"mushroom, carrot, shrimp, pork, garlic",471.0,471.0,393.0,False,2026-03-09T12:54:41.831739,tofu with broccoli | tofu | tofu with | quick tofu with broccoli,4.3,90.0,Medium,,,,,,,,,,,
643.0,Mexican Pasta,Portuguese,Snack,Regular,"mushroom, carrot, tomato, turkey, beef, turmeric, oregano",785.0,1049.0,696.0,True,2026-03-15T12:54:41.831775,mexican pasta | mexican | authentic mexican pasta,4.8,25.0,Medium,,,,,,,,,,,
644.0,Tomato Snack,Brazilian,Breakfast,Regular,"bell pepper, cucumber, garlic, tuna, tofu, garlic, turmeric, cinnamon",570.0,645.0,654.0,True,2026-03-22T12:54:41.831804,tomato snack | tomato | easy tomato snack,4.7,10.0,Medium,,,,,,,,,,,
645.0,Indian Beverage,Lebanese,Appetizer,Gluten-Free,"zucchini, bell pepper, mushroom, fish, salmon, butter, milk, paprika, turmeric",703.0,864.0,588.0,True,2026-03-10T12:54:41.831835,indian beverage | indian | easy indian beverage,4.2,20.0,Hard,,,,,,,,,,,
646.0,Turkish Soup Classic,Turkish,Dinner,Regular,"tomato, onion, garlic, beef, yogurt, ginger",758.0,758.0,694.0,False,2026-03-21T12:54:41.831864,turkish soup classic | turkish | turkish soup | easy turkish soup classic,3.8,60.0,Medium,,,,,,,,,,,
647.0,Chinese Stew Easy,Portuguese,Dessert,Regular,"tomato, carrot, bell pepper, garlic, beef, cheddar, thyme, oregano",733.0,733.0,809.0,False,2026-03-04T12:54:41.831891,chinese stew easy | chinese | chinese stew | best chinese stew easy,3.7,10.0,Easy,,,,,,,,,,,
648.0,Easy Lamb Stew,Mexican,Appetizer,Regular,"bell pepper, cucumber, tofu, oregano, basil, ginger",661.0,661.0,686.0,False,2026-03-06T12:54:41.831921,easy lamb stew | easy | easy lamb | easy easy lamb stew,5.0,60.0,Hard,,,,,,,,,,,
649.0,Quick Lunch Thai Sandwich,Indian,Soup,Vegetarian,"bell pepper, spinach, lamb, thyme",746.0,746.0,605.0,False,2026-03-17T12:54:41.831948,quick lunch thai sandwich | quick | quick lunch | quick lunch thai | best quick lunch thai sandwich,3.8,25.0,Easy,,,,,,,,,,,
650.0,Mexican Bowl Fusion,Greek,Beverage,Regular,"garlic, mushroom, broccoli, zucchini, fish, cinnamon",708.0,708.0,740.0,False,2026-03-01T12:54:41.831975,mexican bowl fusion | mexican | mexican bowl | best mexican bowl fusion,4.9,60.0,Easy,,,,,,,,,,,
651.0,Caribbean Fish,American,Appetizer,Low-Carb,"garlic, broccoli, turkey, mozzarella, cumin",576.0,586.0,561.0,True,2026-02-26T12:54:41.832003,caribbean fish | caribbean | easy caribbean fish,4.8,30.0,Hard,,,,,,,,,,,
652.0,Quick Beverage Vietnamese Pie,Thai,Beverage,Regular,"tomato, bell pepper, cucumber, broccoli, lamb, mozzarella, thyme, cinnamon",1000.0,1012.0,894.0,True,2026-03-05T12:54:41.832036,quick beverage vietnamese pie | quick | quick beverage | quick beverage vietnamese | easy quick beverage vietnamese pie,3.6,30.0,Easy,,,,,,,,,,,
653.0,Easy Salmon Stew,Italian,Snack,Regular,"garlic, cucumber, broccoli, beef, cream, milk, cumin",604.0,604.0,525.0,False,2026-03-13T12:54:41.832066,easy salmon stew | easy | easy salmon | quick easy salmon stew,4.1,10.0,Hard,,,,,,,,,,,
654.0,Quick Beverage Spanish Stir-fry,Portuguese,Dinner,Regular,"bell pepper, spinach, tomato, shrimp, mozzarella, thyme",729.0,729.0,802.0,False,2026-03-08T12:54:41.832112,quick beverage spanish stir-fry | quick | quick beverage | quick beverage spanish | authentic quick beverage spanish stir-fry,3.7,20.0,Medium,,,,,,,,,,,
655.0,Easy Shrimp Snack,French,Breakfast,Regular,"onion, spinach, broccoli, zucchini, lamb, chicken, cheese, yogurt, cinnamon, oregano",580.0,580.0,679.0,False,2026-02-25T12:54:41.832152,easy shrimp snack | easy | easy shrimp | best easy shrimp snack,4.1,20.0,Easy,,,,,,,,,,,
656.0,Classic Pork Pasta,Turkish,Soup,Regular,"carrot, tomato, onion, cucumber, tuna, fish, cinnamon, oregano",838.0,846.0,846.0,True,2026-01-29T12:54:41.832189,classic pork pasta | classic | classic pork | easy classic pork pasta,4.7,30.0,Hard,,,,,,,,,,,
657.0,Quick Dessert Chinese Burger,Thai,Beverage,Dairy-Free,"broccoli, garlic, cucumber, carrot, pork, turkey, cinnamon, ginger, thyme",574.0,849.0,673.0,True,2026-02-17T12:54:41.832219,quick dessert chinese burger | quick | quick dessert | quick dessert chinese | homemade quick dessert chinese burger,3.9,10.0,Hard,,,,,,,,,,,
658.0,Traditional Shrimp Dessert,Greek,Pasta,High-Protein,"mushroom, tomato, shrimp, thyme, cinnamon",319.0,319.0,295.0,False,2026-02-16T12:54:41.832247,traditional shrimp dessert | traditional | traditional shrimp | quick traditional shrimp dessert,4.8,60.0,Medium,,,,,,,,,,,
659.0,Brazilian Dinner,French,Appetizer,Vegan,"cucumber, garlic, onion, beef, fish, garlic",366.0,542.0,397.0,True,2026-03-22T12:54:41.832275,brazilian dinner | brazilian | homemade brazilian dinner,4.6,60.0,Easy,,,,,,,,,,,
660.0,Japanese Tofu,Lebanese,Dessert,Regular,"tomato, bell pepper, carrot, garlic, chicken, tuna, paprika, cumin",643.0,643.0,594.0,False,2025-11-04T12:54:41.832306,japanese tofu | japanese | easy japanese tofu,4.0,60.0,Hard,,,,,,,,,,,
661.0,Portuguese Cookies Traditional,Asian,Lunch,Keto,"broccoli, cucumber, spinach, salmon, chicken, yogurt, cheese, cinnamon, basil",483.0,565.0,567.0,True,2026-01-28T12:54:41.832337,portuguese cookies traditional | portuguese | portuguese cookies | easy portuguese cookies traditional,3.8,90.0,Medium,,,,,,,,,,,
662.0,Caribbean Tuna,Mexican,Snack,Keto,"carrot, broccoli, zucchini, lamb, shrimp, cream, ginger",380.0,380.0,313.0,False,2026-01-02T12:54:41.832364,caribbean tuna | caribbean | quick caribbean tuna,3.6,60.0,Medium,,,,,,,,,,,
663.0,Modern Pork Breakfast,Italian,Beverage,Regular,"bell pepper, cucumber, fish, beef, basil, turmeric",548.0,813.0,548.0,True,2026-03-05T12:54:41.832397,modern pork breakfast | modern | modern pork | quick modern pork breakfast,3.9,45.0,Medium,,,,,,,,,,,
664.0,Quick Tuna Soup,Japanese,Dessert,Regular,"mushroom, carrot, cucumber, tomato, pork, mozzarella, cheese, thyme",662.0,662.0,728.0,False,2026-02-18T12:54:41.832439,quick tuna soup | quick | quick tuna | best quick tuna soup,4.6,10.0,Easy,,,,,,,,,,,
665.0,Lebanese Sandwich Traditional,Lebanese,Lunch,Regular,"spinach, tomato, zucchini, onion, salmon, pork, cumin",629.0,629.0,517.0,False,2026-02-08T12:54:41.832467,lebanese sandwich traditional | lebanese | lebanese sandwich | quick lebanese sandwich traditional,3.5,15.0,Medium,,,,,,,,,,,
666.0,Quick Soup Indian Pie,Italian,Snack,Keto,"broccoli, zucchini, garlic, beef, lamb, cheese, ginger, paprika",859.0,1143.0,825.0,True,2026-03-07T12:54:41.832509,quick soup indian pie | quick | quick soup | quick soup indian | homemade quick soup indian pie,4.8,20.0,Easy,,,,,,,,,,,
667.0,Thai Stir-fry Easy,Greek,Pasta,Regular,"broccoli, mushroom, carrot, spinach, tuna, salmon, cheese, turmeric",1000.0,1095.0,936.0,True,2026-03-16T12:54:41.832551,thai stir-fry easy | thai | thai stir-fry | easy thai stir-fry easy,4.1,45.0,Easy,,,,,,,,,,,
668.0,Quick Beverage Brazilian Bowl,Thai,Appetizer,High-Protein,"mushroom, cucumber, spinach, onion, shrimp, parmesan, garlic, ginger, thyme",514.0,514.0,562.0,False,2026-03-19T12:54:41.832580,quick beverage brazilian bowl | quick | quick beverage | quick beverage brazilian | easy quick beverage brazilian bowl,4.3,90.0,Easy,,,,,,,,,,,
669.0,Modern Pork Soup,Portuguese,Lunch,Vegan,"zucchini, cucumber, mushroom, bell pepper, tuna, thyme, ginger, basil",645.0,837.0,558.0,True,2026-03-05T12:54:41.832613,modern pork soup | modern | modern pork | quick modern pork soup,3.7,20.0,Medium,,,,,,,,,,,
670.0,Quick Breakfast American Bowl,Portuguese,Dinner,Regular,"carrot, broccoli, turkey, tuna, mozzarella, parmesan, cumin, garlic",402.0,402.0,376.0,False,2026-01-12T12:54:41.832641,quick breakfast american bowl | quick | quick breakfast | quick breakfast american | easy quick breakfast american bowl,4.6,20.0,Medium,,,,,,,,,,,
671.0,Greek Shrimp,German,Pasta,Regular,"onion, carrot, fish, cream, mozzarella, oregano, thyme, ginger",581.0,581.0,617.0,False,2026-02-25T12:54:41.832667,greek shrimp | greek | quick greek shrimp,4.8,25.0,Hard,,,,,,,,,,,
672.0,Brazilian Lamb,Chinese,Pasta,Regular,"bell pepper, cucumber, onion, carrot, beef, fish, butter, yogurt, thyme, basil, turmeric",529.0,529.0,425.0,False,2026-03-11T12:54:41.832699,brazilian lamb | brazilian | easy brazilian lamb,4.7,90.0,Hard,,,,,,,,,,,
673.0,Easy Tofu Pie,Turkish,Appetizer,Regular,"carrot, spinach, beef, parmesan, cumin",671.0,671.0,568.0,False,2026-03-04T12:54:41.832729,easy tofu pie | easy | easy tofu | quick easy tofu pie,5.0,45.0,Hard,,,,,,,,,,,
674.0,Quick Breakfast Lebanese Kebab,Turkish,Lunch,Regular,"spinach, onion, mushroom, beef, turmeric, basil, oregano",694.0,717.0,760.0,True,2026-02-23T12:54:41.832759,quick breakfast lebanese kebab | quick | quick breakfast | quick breakfast lebanese | quick quick breakfast lebanese kebab,3.5,60.0,Medium,,,,,,,,,,,
675.0,Lamb With Onion,Lebanese,Dinner,Regular,"broccoli, onion, lamb, butter, garlic, ginger, oregano",563.0,611.0,517.0,True,2026-02-25T12:54:41.832793,lamb with onion | lamb | lamb with | easy lamb with onion,4.9,20.0,Medium,,,,,,,,,,,
676.0,Lebanese Snack,Portuguese,Dinner,Regular,"garlic, cucumber, broccoli, tomato, lamb, salmon, yogurt, turmeric, garlic",812.0,812.0,733.0,False,2025-11-19T12:54:41.832823,lebanese snack | lebanese | homemade lebanese snack,5.0,45.0,Hard,,,,,,,,,,,
677.0,Quick Lunch Thai Stir-fry,Italian,Snack,Regular,"mushroom, bell pepper, salmon, pork, butter, cream, oregano, thyme",538.0,552.0,528.0,True,2026-02-15T12:54:41.832869,quick lunch thai stir-fry | quick | quick lunch | quick lunch thai | homemade quick lunch thai stir-fry,3.8,90.0,Easy,,,,,,,,,,,
678.0,Classic Lamb Beverage,Thai,Breakfast,Regular,"tomato, onion, carrot, spinach, salmon, garlic",370.0,370.0,381.0,False,2026-03-14T12:54:41.832897,classic lamb beverage | classic | classic lamb | easy classic lamb beverage,4.0,20.0,Easy,,,,,,,,,,,
679.0,Tuna With Tomato,Asian,Breakfast,Dairy-Free,"spinach, mushroom, turkey, ginger, turmeric",564.0,564.0,532.0,False,2026-03-10T12:54:41.832922,tuna with tomato | tuna | tuna with | quick tuna with tomato,4.7,90.0,Medium,,,,,,,,,,,
680.0,Healthy Tofu Dinner,Lebanese,Snack,Regular,"garlic, tomato, tofu, cinnamon, ginger, paprika",750.0,750.0,625.0,False,2026-03-15T12:54:41.832955,healthy tofu dinner | healthy | healthy tofu | authentic healthy tofu dinner,4.2,25.0,Hard,,,,,,,,,,,
681.0,Fusion Lamb Lunch,Japanese,Pasta,Regular,"tomato, cucumber, mushroom, turkey, thyme",685.0,815.0,773.0,True,2026-02-01T12:54:41.832989,fusion lamb lunch | fusion | fusion lamb | best fusion lamb lunch,4.1,15.0,Hard,,,,,,,,,,,
682.0,Mushroom Dessert,Brazilian,Appetizer,Regular,"zucchini, cucumber, fish, pork, yogurt, cumin",490.0,490.0,574.0,False,2026-03-12T12:54:41.833019,mushroom dessert | mushroom | authentic mushroom dessert,3.7,45.0,Medium,,,,,,,,,,,
683.0,Easy Beef Sandwich,Italian,Dinner,Regular,"tomato, broccoli, fish, lamb, parmesan, mozzarella, paprika",718.0,718.0,710.0,False,2026-03-22T12:54:41.833048,easy beef sandwich | easy | easy beef | homemade easy beef sandwich,4.1,45.0,Easy,,,,,,,,,,,
684.0,Quick Dinner Thai Risotto,Portuguese,Breakfast,Regular,"broccoli, carrot, tuna, lamb, parmesan, cream, paprika, basil, ginger",892.0,1184.0,914.0,True,2025-12-06T12:54:41.833090,quick dinner thai risotto | quick | quick dinner | quick dinner thai | authentic quick dinner thai risotto,4.6,45.0,Easy,,,,,,,,,,,
